{
  "id": "base:back_room_extension",
  "type": "upgrade",
  "name": "loc:upgrade.back_room_extension",
  "description": "loc:upgrade.back_room_extension.description",
  "cost": 8200.0,
  "prerequisites": [],
  "unlocks": [
    "back_room_extension"
  ],
  "category": "space",
  "costs_space": 0,
  "removes_step": "shuffling stock to reach stock"
}
