{
  "id": "base:reference_binder_stand_tier_2",
  "type": "upgrade",
  "name": "loc:upgrade.reference_binder_stand_tier_2",
  "description": "loc:upgrade.reference_binder_stand_tier_2.description",
  "cost": 468.0,
  "prerequisites": [],
  "unlocks": [
    "reference_binder_stand"
  ],
  "category": "quality_of_life",
  "costs_space": 1
}
