{
  "id": "base:griddle_timer_array_tier_3",
  "type": "upgrade",
  "name": "loc:upgrade.griddle_timer_array_tier_3",
  "description": "loc:upgrade.griddle_timer_array_tier_3.description",
  "cost": 3250.0,
  "prerequisites": [],
  "unlocks": [
    "griddle_timer_array"
  ],
  "category": "automation",
  "costs_space": 2,
  "removes_step": "tracking timings by eye"
}
