{
  "id": "base:griddle_timer_array",
  "type": "upgrade",
  "name": "loc:upgrade.griddle_timer_array",
  "description": "loc:upgrade.griddle_timer_array.description",
  "cost": 1250.0,
  "prerequisites": [],
  "unlocks": [
    "griddle_timer_array"
  ],
  "category": "automation",
  "costs_space": 0,
  "removes_step": "tracking timings by eye"
}
