{
  "id": "base:laminated_checklist_tier_2",
  "type": "upgrade",
  "name": "loc:upgrade.laminated_checklist_tier_2",
  "description": "loc:upgrade.laminated_checklist_tier_2.description",
  "cost": 72.0,
  "prerequisites": [],
  "unlocks": [
    "laminated_checklist"
  ],
  "category": "quality_of_life",
  "costs_space": 1
}
